<?xml version="1.0" encoding="UTF-8"?>
<!DOCTYPE baseservlet-config SYSTEM "/WEB-INF/dtd/BaseDao-config.dtd">
<namespace name="" class="" table="">
<resultMap>
    <id column="id" property="id">
      <generator class="uuid"/>
    </id>
    <result column="userName" property="userName" />
    <result column="userAge" property="userAge" />
    <result column="userAddress" property="userAddress" />
</resultMap>
<sql id="" type="">
<![CDATA[ ]]>
</sql>
</namespace>